{
  "schema_version": "phase8-engineering-candidate-scope.v1",
  "phase": 8,
  "accepted_entry_sha": "3c60bf5cc4e051a214e158cbf944fd6aba969f95",
  "self_path": "contracts/agent-platform/phase8/engineering-candidate-scope.json",
  "authority": {
    "authority_ceiling": "PHASE_8_ENGINEERING_CANDIDATE_SCOPE_ONLY",
    "engineering_checkpoint_granted": false,
    "production_access": false,
    "production_actions": false,
    "production_checkpoint_granted": false,
    "production_credentials": false,
    "production_traffic": false,
    "promotion_granted": false
  },
  "allowed_changes": [
    {
      "path": ".github/workflows/phase8-engineering-caller.yml",
      "status": "A"
    },
    {
      "path": ".github/workflows/phase8-engineering-witness.yml",
      "status": "A"
    },
    {
      "path": "contracts/agent-platform/phase8/active-reference-report.schema.json",
      "status": "A"
    },
    {
      "path": "contracts/agent-platform/phase8/checkpoint-evidence.schema.json",
      "status": "A"
    },
    {
      "path": "contracts/agent-platform/phase8/engineering-candidate-commands.json",
      "status": "A"
    },
    {
      "path": "contracts/agent-platform/phase8/engineering-candidate-scope.json",
      "status": "A"
    },
    {
      "path": "contracts/agent-platform/phase8/engineering-candidate-scope.schema.json",
      "status": "A"
    },
    {
      "path": "contracts/agent-platform/phase8/engineering-p0-disposition.schema.json",
      "status": "A"
    },
    {
      "path": "contracts/agent-platform/phase8/github-attestation-policy.json",
      "status": "A"
    },
    {
      "path": "deploy/observability/phase8/alerts.yaml",
      "status": "A"
    },
    {
      "path": "deploy/observability/phase8/dashboards/agentrun-stream.json",
      "status": "A"
    },
    {
      "path": "deploy/observability/phase8/dashboards/command-outbox.json",
      "status": "A"
    },
    {
      "path": "deploy/observability/phase8/dashboards/disaster-recovery.json",
      "status": "A"
    },
    {
      "path": "deploy/observability/phase8/dashboards/graph-checkpoint-lease.json",
      "status": "A"
    },
    {
      "path": "deploy/observability/phase8/dashboards/model-provider.json",
      "status": "A"
    },
    {
      "path": "deploy/observability/phase8/dashboards/projection-reconciliation.json",
      "status": "A"
    },
    {
      "path": "deploy/observability/phase8/dashboards/security.json",
      "status": "A"
    },
    {
      "path": "deploy/observability/phase8/dashboards/temporal-queue-history.json",
      "status": "A"
    },
    {
      "path": "deploy/observability/phase8/otel-collector.yaml",
      "status": "A"
    },
    {
      "path": "deploy/observability/phase8/recording-rules.yaml",
      "status": "A"
    },
    {
      "path": "deploy/production/phase8/capacity-policy.yaml",
      "status": "A"
    },
    {
      "path": "deploy/production/phase8/hpa.yaml",
      "status": "A"
    },
    {
      "path": "deploy/production/phase8/java-agent-worker.yaml",
      "status": "A"
    },
    {
      "path": "deploy/production/phase8/java-api.yaml",
      "status": "A"
    },
    {
      "path": "deploy/production/phase8/java-control-worker.yaml",
      "status": "A"
    },
    {
      "path": "deploy/production/phase8/kustomization.yaml",
      "status": "A"
    },
    {
      "path": "deploy/production/phase8/litellm.yaml",
      "status": "A"
    },
    {
      "path": "deploy/production/phase8/pdb.yaml",
      "status": "A"
    },
    {
      "path": "deploy/production/phase8/pgbouncer.yaml",
      "status": "A"
    },
    {
      "path": "deploy/production/phase8/postgres-read-service.yaml",
      "status": "A"
    },
    {
      "path": "deploy/production/phase8/python-agent.yaml",
      "status": "A"
    },
    {
      "path": "deploy/production/phase8/security/kms-vault-policy.yaml",
      "status": "A"
    },
    {
      "path": "deploy/production/phase8/security/mtls-policies.yaml",
      "status": "A"
    },
    {
      "path": "deploy/production/phase8/security/network-policies.yaml",
      "status": "A"
    },
    {
      "path": "deploy/production/phase8/security/object-store-policy.yaml",
      "status": "A"
    },
    {
      "path": "deploy/production/phase8/security/rbac.yaml",
      "status": "A"
    },
    {
      "path": "deploy/production/phase8/security/workload-identities.yaml",
      "status": "A"
    },
    {
      "path": "deploy/production/phase8/topology-spread.yaml",
      "status": "A"
    },
    {
      "path": "docs/runbooks/temporal-first/phase-8-alert-response.md",
      "status": "A"
    },
    {
      "path": "docs/runbooks/temporal-first/phase-8-domain-pitr.md",
      "status": "A"
    },
    {
      "path": "docs/runbooks/temporal-first/phase-8-graph-object-restore.md",
      "status": "A"
    },
    {
      "path": "docs/runbooks/temporal-first/phase-8-rotation.md",
      "status": "A"
    },
    {
      "path": "docs/runbooks/temporal-first/phase-8-security-hardening.md",
      "status": "A"
    },
    {
      "path": "docs/runbooks/temporal-first/phase-8-temporal-regional-dr.md",
      "status": "A"
    },
    {
      "path": "infra-tests/phase8/capacity/admission_contract.py",
      "status": "A"
    },
    {
      "path": "infra-tests/phase8/capacity/run_capacity_model.py",
      "status": "A"
    },
    {
      "path": "infra-tests/phase8/capacity/scenario.yaml",
      "status": "A"
    },
    {
      "path": "infra-tests/phase8/capacity/test_admission_contract.py",
      "status": "A"
    },
    {
      "path": "infra-tests/phase8/runtime/Dockerfile",
      "status": "A"
    },
    {
      "path": "infra-tests/phase8/runtime/requirements.in",
      "status": "A"
    },
    {
      "path": "infra-tests/phase8/runtime/requirements.lock",
      "status": "A"
    },
    {
      "path": "infra-tests/phase8/runtime/runtime-policy.json",
      "status": "A"
    },
    {
      "path": "infra-tests/phase8/scenarios/chaos-and-failover.yaml",
      "status": "A"
    },
    {
      "path": "infra-tests/phase8/scenarios/load-and-burst.yaml",
      "status": "A"
    },
    {
      "path": "infra-tests/phase8/scenarios/replay-and-dr.yaml",
      "status": "A"
    },
    {
      "path": "infra-tests/phase8/scenarios/security-and-rotation.yaml",
      "status": "A"
    },
    {
      "path": "infra-tests/phase8/scenarios/soak.yaml",
      "status": "A"
    },
    {
      "path": "infra-tests/phase8/scenarios/unified-checkpoint.yaml",
      "status": "A"
    },
    {
      "path": "java-api-service/mvnw",
      "status": "M"
    },
    {
      "path": "java-api-service/src/main/java/com/example/dispute/agentstream/application/AgentRunRecoveryScheduler.java",
      "status": "M"
    },
    {
      "path": "java-api-service/src/main/java/com/example/dispute/agentstream/application/AgentRunV2StreamStore.java",
      "status": "M"
    },
    {
      "path": "java-api-service/src/main/java/com/example/dispute/agentstream/infrastructure/delivery/RedisAgentRunStreamWakeupPublisher.java",
      "status": "M"
    },
    {
      "path": "java-api-service/src/main/java/com/example/dispute/agentstream/infrastructure/delivery/RedisAgentRunStreamWakeupSubscriber.java",
      "status": "M"
    },
    {
      "path": "java-api-service/src/main/java/com/example/dispute/agentstream/infrastructure/delivery/WakeupPublishingAgentRunV2StreamStore.java",
      "status": "M"
    },
    {
      "path": "java-api-service/src/main/java/com/example/dispute/agentstream/infrastructure/persistence/AgentRunStreamArchiveStore.java",
      "status": "A"
    },
    {
      "path": "java-api-service/src/main/java/com/example/dispute/agentstream/infrastructure/persistence/AgentRunStreamEventEntity.java",
      "status": "M"
    },
    {
      "path": "java-api-service/src/main/java/com/example/dispute/agentstream/infrastructure/persistence/AgentRunStreamEventRepository.java",
      "status": "M"
    },
    {
      "path": "java-api-service/src/main/java/com/example/dispute/agentstream/infrastructure/persistence/AgentRunStreamRetentionManifest.java",
      "status": "M"
    },
    {
      "path": "java-api-service/src/main/java/com/example/dispute/agentstream/infrastructure/persistence/PostgresAgentRunV2EventStore.java",
      "status": "M"
    },
    {
      "path": "java-api-service/src/main/java/com/example/dispute/agentstream/infrastructure/persistence/StreamBackfillCoordinator.java",
      "status": "A"
    },
    {
      "path": "java-api-service/src/main/java/com/example/dispute/agentstream/infrastructure/persistence/StreamCompatibilityMode.java",
      "status": "A"
    },
    {
      "path": "java-api-service/src/main/java/com/example/dispute/hearing/application/HearingFlowDeadlineScheduler.java",
      "status": "M"
    },
    {
      "path": "java-api-service/src/main/java/com/example/dispute/hearing/application/HearingReviewHandoffRecoveryScheduler.java",
      "status": "M"
    },
    {
      "path": "java-api-service/src/main/java/com/example/dispute/workflow/recovery/hearing/HearingSchedulerControl.java",
      "status": "M"
    },
    {
      "path": "java-api-service/src/main/java/com/example/dispute/workflow/recovery/hearing/HearingSchedulerDetector.java",
      "status": "M"
    },
    {
      "path": "java-api-service/src/main/java/com/example/dispute/workflow/recovery/hearing/JdbcHearingSchedulerDetector.java",
      "status": "M"
    },
    {
      "path": "java-api-service/src/main/resources/db/migration/V046__stream_partition_and_retention.sql",
      "status": "A"
    },
    {
      "path": "java-api-service/src/test/java/com/example/dispute/agentstream/AgentRunRecoverySchedulerTest.java",
      "status": "M"
    },
    {
      "path": "java-api-service/src/test/java/com/example/dispute/agentstream/delivery/RedisAgentRunStreamFailoverTest.java",
      "status": "A"
    },
    {